{
  "$schema": "../../template/board.schema.json",
  "slug": "roman-evaluator-java",
  "name": "Roman Evaluator Java",
  "lanes": 2,
  "integration-tests": [
    false,
    true
  ],
  "auto-gates": [
    "Gi",
    "Gp",
    "Gc"
  ],
  "goal-cards": [
    "I",
    "P",
    "TW",
    "C",
    "TI"
  ],
  "max-runtime": "20m",
  "max-reworks": 3,
  "model_override": "deepseek-v4.1-flash",
  "provider_override": "opencode-go"
}
