{
  "$schema": "../../template/board.schema.json",
  "slug": "roman-evaluator-js",
  "name": "Roman Evaluator JS",
  "lanes": 1,
  "integration-tests": false,
  "auto-gates": [
    "Gi",
    "Gp",
    "Gc"
  ],
  "sequential": true,
  "goal-cards": [
    "C"
  ],
  "max-runtime": "30m",
  "max-reworks": 2,
  "model": "qwen38-27b",
  "provider": "llama-swap",
  "model_override": "deepseek-v4.1-flash",
  "provider_override": "opencode-go"
}
