{
  "$schema": "../../template/board.schema.json",
  "slug": "portfolio-engineering",
  "name": "Portfolio Engineering",
  "lanes": 1,
  "default-workdir": "/home/wos/.hermes/profiles/trader",
  "integration-tests": false,
  "auto-gates": [
    "Gi",
    "Gp",
    "Gc"
  ],
  "goal-cards": [
    "C"
  ],
  "goal-max-turns": 80,
  "max-reworks": 2,
  "model_override": "deepseek-v4.1-flash",
  "provider_override": "opencode-go"
}
