{
  "$schema": "../../template/board.schema.json",
  "slug": "is-even",
  "name": "Is even smoke test",
  "lanes": 1,
  "unit-tests": true,
  "integration-tests": false,
  "default-workdir": "/opt/projects/kanban/main/kanban/boards/is-even/work",
  "auto-gates": [
    "Gi",
    "Gp",
    "Gc"
  ],
  "sequential": false,
  "goal-cards": [
    "C"
  ],
  "max-runtime": "30m",
  "max-reworks": 2,
  "model": "swift15-27b",
  "provider": "llama-swap"
}
