{
  "$schema": "../../template/board.schema.json",
  "slug": "blade-workspace",
  "name": "Blade Workspace (external project)",
  "lanes": 1,
  "default-workdir": "/home/playground/liferay/workspaces/blade-workspace",
  "unit-tests": true,
  "integration-tests": true,
  "auto-gates": [
    "Gi"
  ],
  "goal-cards": [
    "C",
    "TI"
  ],
  "goal-max-turns": 80,
  "max-runtime": "60m",
  "max-reworks": 4,
  "model": "deepseek-v4.1-flash",
  "provider": "opencode-go",
  "model_override": "deepseek-v4.1-flash",
  "provider_override": "opencode-go",
  "refinement": true
}
