{
  "$schema": "../../template/board.schema.json",
  "slug": "arena-federated-search",
  "name": "Arena Federated Search (external project)",
  "lanes": 1,
  "default-workdir": "/opt/projects/arena-federated-search/main/arena-federated-search",
  "unit-tests": true,
  "integration-tests": false,
  "auto-gates": [
    "Gi"
  ],
  "goal-cards": [
    "C"
  ],
  "goal-max-turns": 80,
  "max-runtime": "60m",
  "max-reworks": 4,
  "model": "deepseek-v4.1-flash",
  "provider": "opencode-go",
  "model_override": "deepseek-v4.1-flash",
  "provider_override": "opencode-go",
  "refinement": true
}
